lon,lat,school_name,ward_code,ward_name,lga_code,lga_name
7.72603193,11.13651205,Integrated Children School,KD1904,Dogarawa,19019,Sabon Gari
8.012568355,11.28114581,Universal Basic Education Anguwan Sariki Primary School,KD1805,Gubuchi,19018,Makarfi
8.31232109,9.788480221,Baptist Mission Academy,KD2210,Zonkwa,19022,Zangon Kataf
7.89701879,9.791044594,Universal Basic Education Primary School Ungwan Atiku,KD0802,Ankwa,19008,Kachia
7.99474053,11.43738644,LGEA Angwan Halliru Primary School,KD0508,Rumi,19005,Ikara
7.78161832,10.76374252,Kwan Kwani Primary School,KD0405,Igabi,19004,Igabi
7.395912409,10.43103576,LGEA Primary School Gonin Gora,KD0203,Kakau,19002,Chikun
7.43842005,10.51000102,LGEA Sabon Gari Primary School,KD0904,Kabala,19009,Kaduna North
8.49519862,9.22884641,LGEA Nandu B,KD2007,Nandu,19020,Sanga
7.81010955,9.735524831,Universal Basic Education Akwaya Daji,KD0803,Awon,19008,Kachia
7.61099764,11.19464653,LEA Primary School Hayin Sambo,KD1902,Bomo,19019,Sabon Gari
7.26785116,11.25238599,LGEA Primary School Anguwan Namama,KD0305,Idasu,19003,Giwa
7.786431313,9.576982857,Universal Basic Education Primary School Cikin Gari Kuchi,KD1110,Kushe,19011,Kagarko
8.32410887,9.711612061,LGEA Aduwuan Gida,KD2205,Madakiya,19022,Zangon Kataf
7.696963549,9.515045286,Universal Basic Education Primary School Kago,KD1106,Kagarko South,19011,Kagarko
7.72519398,11.18333848,LEA Primary School Sakadadi,KD1904,Dogarawa,19019,Sabon Gari
6.28685171,10.67155998,L G Ae Chikwarba Primary School,KD0102,Kakangi,19001,Birnin Gwari
8.013818264,9.730775357,Universal Basic Education Boham Primary School,KD0806,Gidan Tagwai,19008,Kachia
7.436955571,10.51746726,2nd Ecwa Nursery and Primary School,KD0904,Kabala,19009,Kaduna North
7.44228749,10.47767749,Christ Mission Academy,KD0207,Narayi,19002,Chikun
8.55295314,10.05172745,Universal Basic Education Primaru School Talon Amawa,KD1703,Garu Mariri,19017,Lere
7.449835,10.47436,Sacret Heart Nur Primary and Secondary School,KD0207,Narayi,19002,Chikun
8.034680486,11.06657445,Universal Basic Education Gidan Kori,KD2110,Turawa,19021,Soba
7.44490125,10.56994738,Demostration Nursry and Primary School,KD0909,Unguwan Dosa,19009,Kaduna North
8.25177082,9.705595761,Universal Basic Education Primary School Hurgyam,KD2205,Madakiya,19022,Zangon Kataf
8.28469,10.095895,Model Kusheka,KD1402,Bital,19014,Kauru
8.281701207,9.371026754,LGEA Dangwa,KD0706,Jagindi,19007,Jema'A
8.052742481,9.600934982,Government Secondary School Antong,KD0810,Kurmin Musa,19008,Kachia
7.387278333,10.49917,Katari Schools,KD1011,Sabon Gari West,19010,Kaduna South
7.917929292,9.322623611,LGEA Primary School Idar,KD0606,Nduya,19006,Jaba
8.16013569,9.433338581,Gdlss Asso,KD0701,Asso,19007,Jema'A
8.31936829,9.767461791,LGEA Madauchi 1,KD2210,Zonkwa,19022,Zangon Kataf
7.47079255,10.62409328,Nti Model Staff Primary School,KD0408,Rigachikun,19004,Igabi
7.924822569,11.33342206,Government Junior Secondary School Gimi,KD1804,Gimi,19018,Makarfi
8.100839853,11.12710118,LEA Makwaron Lemo,KD2110,Turawa,19021,Soba
8.02524995,11.36780093,LGEA Rumi Primary School,KD0508,Rumi,19005,Ikara
7.43821139,10.57218973,Army Children SchoolNew Cantonment B,KD0903,Hayin Banki,19009,Kaduna North
8.28249806,9.575677081,Grace Land Academy Katsit Kanfancha,KD0707,Kafanchan A,19007,Jema'A
7.49570844,10.40038705,LGEA Rido,KD0209,Rido,19002,Chikun
8.28332061,9.597454951,LGEA Primary School Zakwo,KD2201,Gidan Jatau,19022,Zangon Kataf
7.643828988,9.749459625,LGEA Kurmin Ajiya,KD0803,Awon,19008,Kachia
7.405434251,10.59595406,Government Secondary School Sabon Afaka,KD0401,Afaka,19004,Igabi
7.40155751,11.05916047,Government Junior Secondary School Iyatawa,KD0307,Kidandan,19003,Giwa
8.36046043,10.57036095,Universal Basic Education Unguwan Bature,KD1509,Pambegua,19015,Kubau
7.77479042,10.04879469,Universal Basic Education Kampani,KD1208,Maro,19012,Kajuru
8.65503,10.06594,LEA Primary School Balak,KD1703,Garu Mariri,19017,Lere
6.566428542,10.71348846,LEA Primary School Mando,KD0101,Gayam,19001,Birnin Gwari
8.77398,10.30399667,Universal Basic Education Primary School Tashan Dogara,KD1701,Abadawa,19017,Lere
7.46787966,11.25554219,Doctor Shehu Lawal Giwa Staff School,KD0304,Giwa,19003,Giwa
7.46133151,10.45290103,Zerephat Academy,KD0211,Sabon Tasha,19002,Chikun
8.555755,9.974313334,Eccde Preprimary School Rafin Gora,KD1403,Damakasuwa,19014,Kauru
7.931399345,9.552488924,Government Secondary School Junior Kenyi,KD1101,Aribi,19011,Kagarko
7.45422601,10.44504624,Christ Ambassador Nursery Primary and Secondary School,KD0211,Sabon Tasha,19002,Chikun
8.22540279,11.17481877,Wisdom Nursery and Primary School,KD0502,Ikara,19005,Ikara
8.142537475,9.58741665,LGEA Kurmin Zomo,KD0602,Daddu,19006,Jaba
8.644609451,10.27116537,LGEA Primary School Guma,KD1707,Lazuru Tuddai,19017,Lere
8.12625412,11.41221953,LGEA Angwan Ango Mukkaddas Primary School,KD0505,Kuya,19005,Ikara
8.60823623,9.338761731,LGEA Kongon,KD2004,Bokana,19020,Sanga
7.970795631,9.873753191,LGEA Primary School Ugwan Pah Ii,KD0807,Gumel,19008,Kachia
8.635228333,10.519495,Universal Basic Education Primary School Kakum Amawa,KD1705,Kayarda,19017,Lere
8.32795028,9.766170551,Universal Basic Education Madauchi II,KD2210,Zonkwa,19022,Zangon Kataf
7.44289364,10.55652762,LEA Nursery and Primary School Ungwan Kanawa,KD0903,Hayin Banki,19009,Kaduna North
8.104117513,10.83814681,Universal Basic Education Marmara Rahama,KD2108,Rahama,19021,Soba
7.413877845,10.50849259,LGEA Primary Schooll Fulani Road Tudun Wada Kaduna,KD1010,Tudun Wada South,19010,Kaduna South
6.934753333,10.63389833,First Baptist Nursery and Primary School,KD0205,Kunai,19002,Chikun
8.52110166,11.10507747,Universal Basic Education Anguwan Kambu Primary School,KD1504,Haskiya,19015,Kubau
7.7604099,11.02151445,Government Junior Secondary School Aba Zaria,KD2313,Wuciciri,19023,Zaria
8.463254571,9.489344359,Nomadic Primary School,KD0702,Atuku,19007,Jema'A
7.422133684,10.34554303,Universal Basic Education Primary School Ungwan Pah Kakau,KD0203,Kakau,19002,Chikun
7.57361981,10.52544857,Universal Basic Education Lokotuko,KD0204,Kujama,19002,Chikun
7.75924398,10.69895054,Hayingada Primary School,KD0403,Fanshanu,19004,Igabi
6.550233364,10.67071259,Government Secondary Schools Birnin Gwari,KD0103,Magajin Gari 1,19001,Birnin Gwari
8.37103387,9.225207901,Universal Basic Education Gbonkok,KD2002,Arak,19020,Sanga
7.77636067,11.16174612,Unguwan Wakili Nomadic Primary School,KD1911,Zabi,19019,Sabon Gari
8.27291548,10.78346371,LGEA Primary School,KD1511,Zuntu,19015,Kubau
7.72080364,11.03585697,Gidan Kano Universal Basic Education,KD2303,Gyellesu,19023,Zaria
7.73511056,11.07616814,Universal Basic Education Unguwan Kaya,KD2303,Gyellesu,19023,Zaria
7.875657678,9.650877715,Nomadic Rugan Ardo Primary School Unguwan Pah,KD1101,Aribi,19011,Kagarko
7.477574944,11.036641,Nomadic Murai,KD0310,Wazata,19003,Giwa
8.3045526,10.75538812,Universal Basic Education Kagadama Zuntu Primary School,KD1505,Kareh,19015,Kubau
6.216427088,10.55636466,LGEA Primary School,KD0106,Randagi,19001,Birnin Gwari
7.20380407,11.14606784,LGEA Primary School Jigo,KD0305,Idasu,19003,Giwa
8.000058532,9.975264072,Army Children School Nasa,KD0801,Agunu,19008,Kachia
7.44279491,9.52055422,LEA Issah Pago,KD1103,Jere North,19011,Kagarko
8.618513333,9.807068333,LEA Primary School Kizakoro,KD1406,Kamaru,19014,Kauru
7.32059598,9.402306676,Universal Basic Education Prary School Gwaba,KD1102,Iddah,19011,Kagarko
7.688965201,9.854017497,Universal Basic Education Gizago,KD0802,Ankwa,19008,Kachia
8.17376293,10.07495745,Government Junior Secondary School Ungwa Makama,KD2203,Ikulu,19022,Zangon Kataf
8.165524006,9.692269564,LGEA Primary Sch Abet,KD2201,Gidan Jatau,19022,Zangon Kataf
7.5067732,10.57614724,Universal Basic Education Anguwan Tudu Primary School,KD0408,Rigachikun,19004,Igabi
7.952658534,9.708175064,Universal Basic Education Unguwan Waja,KD0811,Kwaturu,19008,Kachia
7.761186361,9.554516673,Government Secondary School Kushe Makaranta,KD1110,Kushe,19011,Kagarko
7.901111841,9.598268868,Government Secondary School Kurumi Dangana,KD1101,Aribi,19011,Kagarko
7.97975421,11.28957331,Universal Basic Education Anguwan Kunda,KD1808,Meyari,19018,Makarfi
8.455025,9.225873021,LGEA Intergreted Quranic School Gwantu,KD2005,Gwantu,19020,Sanga
7.19356061,10.31029158,Universal Basic Education Unguwan Turai,KD0202,Gwagwada,19002,Chikun
7.53653867,11.22185589,Bilal Academy My Baby Nursery and Primary School Maraba Guga,KD0309,Shika,19003,Giwa
7.72330185,11.08650756,Haruna Danja Foundation,KD2310,Tudun Wada,19023,Zaria
7.45408734,10.43888025,Greatway International School,KD0211,Sabon Tasha,19002,Chikun
7.349290252,9.419655205,Sanpat Royal Academy Nursery and Primary School,KD1102,Iddah,19011,Kagarko
8.63687928,9.357131801,LGEA Amantu,KD2004,Bokana,19020,Sanga
8.56795,9.818690001,LGEA Primary School,KD1406,Kamaru,19014,Kauru
7.460328341,9.815329313,Universal Basic Education Primary School Sabon Akilbu,KD0805,Dokwa,19008,Kachia
8.163464069,9.72525537,LGEA,KD2204,Kamantan,19022,Zangon Kataf
7.76498987,11.10540789,Universal Basic Education Anguwan Mairogo,KD2302,Dambo,19023,Zaria
8.36152214,10.68742209,Universal Basic Education Kampanin Jidda,KD1505,Kareh,19015,Kubau
7.77715837,10.04518752,Government Secondary School Maro,KD1208,Maro,19012,Kajuru
8.695601667,10.40457,LEA Primary School Hayingada Saminaka,KD1701,Abadawa,19017,Lere
8.044282794,9.595554471,Universal Basic Education Primary School Unguwan Gishiri,KD0810,Kurmin Musa,19008,Kachia
8.207374389,11.05693075,Normadic Primary School Filan Bature,KD1508,Mah,19015,Kubau
7.814143896,11.23452365,Universal Basic Education Hawan Maimashi,KD1801,Dan Damisa,19018,Makarfi
7.812808156,9.434788227,LGEA Primary School Anguwan Galadima Kubacha,KD1107,Katugal,19011,Kagarko
8.24527301,11.31158194,Universal Basic Education Nomadic Daba Mabuga Primary School,KD0504,Kurmin Kogi,19005,Ikara
7.4530671,10.44659202,Fradapal El-Shaddai School,KD0211,Sabon Tasha,19002,Chikun
8.033586144,9.683343173,Nomadic Primary School Kurmin Gyada,KD0811,Kwaturu,19008,Kachia
7.71659538,11.11011681,Zaria Children School GRA Sabon Gari,KD1905,Hanwa,19019,Sabon Gari
7.45640417,10.43297494,Universal Basic Education Primary School Unguwan Barde,KD0211,Sabon Tasha,19002,Chikun
8.104943633,9.587030412,Universal Basic Education Primary School Ungwan Kifi,KD0602,Daddu,19006,Jaba
7.68878243,11.08060275,Great Standard School,KD2309,Tukur Tukur,19023,Zaria
8.45928071,9.812348501,Government Secondary School Magamiya,KD2211,Zonzon,19022,Zangon Kataf
8.3104416,11.02844159,Universal Basic Education Bahori Primary School,KD1508,Mah,19015,Kubau
7.80621793,9.844578561,Government Secondary School,KD0803,Awon,19008,Kachia
8.41730685,9.86671164,LGEA Gidan Zaki,KD2211,Zonzon,19022,Zangon Kataf
8.536145,10.54666667,Universal Basic Education Primary School Kawo Mauda,KD1706,Kudaru,19017,Lere
7.64755541,10.90701255,Eccde Kamfanin Zangon Aya B Pre Primary School,KD0412,Zangon Aya,19004,Igabi
8.27702057,9.780206531,Government Girlsâ?? Secondary School,KD2210,Zonkwa,19022,Zangon Kataf
7.391545773,10.58699012,LGEA,KD0401,Afaka,19004,Igabi
8.29292357,9.578002096,Government Senior Secondary School Kafanchan,KD0707,Kafanchan A,19007,Jema'A
7.58815185,11.13581395,Universal Basic Education Primary School Yan Daka,KD0308,Panhauya,19003,Giwa
8.58870052,11.00616462,Nomadic Dori Primary Dori,KD1504,Haskiya,19015,Kubau
8.0019629,9.491431118,Nomadic,KD0607,Nok,19006,Jaba
7.963398099,9.484827519,LGEA Primary School,KD0603,Dura Bitaro,19006,Jaba
7.17874596,10.28891205,LGEA Shepe,KD0202,Gwagwada,19002,Chikun
8.54400668,9.338748891,Universal Basic Education Ayu Seminary,KD2004,Bokana,19020,Sanga
7.617189288,11.01934612,Universal Basic Education Kasuwan Dutse,KD2301,Dutsen Abba,19023,Zaria
7.72364492,11.07264498,Bene Cpmprhensive School,KD2306,Kwarbai A,19023,Zaria
8.31760413,11.13287758,Universal Basic Education Dion Sabo,KD1506,Kargi,19015,Kubau
8.54681669,10.76182453,Universal Basic Education Koso Primary School,KD1502,Damau,19015,Kubau
7.407723333,10.51950833,Auntee Niimatu Nursery Primary and Junior Secondary School,KD1007,Sabon Gari South,19010,Kaduna South
8.011876345,10.04181504,Universal Basic Education Primary Kurmi Biri Ii,KD0801,Agunu,19008,Kachia
7.40405019,10.41288002,Liberty International School,KD0203,Kakau,19002,Chikun
7.797036767,11.22543633,Universal Basic Education,KD1609,Taba,19016,Kudan
7.42268978,10.4322046,Ammega Model Nursery Primary School and Ssecondary School,KD0212,Yelwa,19002,Chikun
8.575076,9.084046,Local Government Education Authority Primary School,KD2009,Ninzo South,19020,Sanga
8.30602987,9.582837811,LGEA Ungwar Mamuda,KD0711,Maigizo,19007,Jema'A
7.747780681,11.24755919,LGEA Lafiya,KD1602,Garu,19016,Kudan
7.430663109,10.50224841,A B S I Primary School,KD0902,Dadi Riba,19009,Kaduna North
8.20737461,11.05674875,Universal Basic Education Unguwan Tafki Primary School,KD1508,Mah,19015,Kubau
7.817367911,11.27753019,Universal Basic Education Anguwan Makera,KD1801,Dan Damisa,19018,Makarfi
7.05697376,11.03541419,LGEA Ruwan Sarki,KD0107,Damari,19001,Birnin Gwari
6.929676667,10.57924167,Universal Basic Education Kunai Primary School,KD0205,Kunai,19002,Chikun
7.330797,11.05885632,Government Junior Secondary School Galadimawa,KD0302,Galadimawa,19003,Giwa
6.111965775,10.78542531,Universal Basic Education Primary School Ishiwai,KD0102,Kakangi,19001,Birnin Gwari
7.985955477,9.430984855,Baptist High School,KD0603,Dura Bitaro,19006,Jaba
8.22456535,10.75248606,Universal Basic Education Wanya Primary School,KD1511,Zuntu,19015,Kubau
7.95232061,10.46655009,Universal Basic Education Sabon Gida,KD1205,Kallah,19012,Kajuru
8.472691667,10.51519167,LEA Primary School Maiyamma I,KD1706,Kudaru,19017,Lere
8.18017411,11.21436838,LGEA Dan Lawal Primary School,KD0504,Kurmin Kogi,19005,Ikara
8.382235765,9.387935401,Anglican Nursery and Primary School,KD0705,Godogodo,19007,Jema'A
8.52218425,10.14515659,Normadic Primary School Jamaar Iya,KD1703,Garu Mariri,19017,Lere
8.352500796,9.437513351,Model Primary School Godogodo,KD0705,Godogodo,19007,Jema'A
7.46501373,10.45652926,Lite Academy,KD0211,Sabon Tasha,19002,Chikun
7.47443208,11.24813993,Government Day Secondary School Giwa,KD0306,Kakangi,19003,Giwa
6.393409967,10.66219926,Universal Basic Education,KD0104,Magajin Gari 2,19001,Birnin Gwari
7.2715431,10.82399764,Universal Basic Education Primary School Rikau,KD0410,Sabon Birnin,19004,Igabi
7.72331309,11.10680143,Nigerian Railway Staff School,KD1903,Chikaji,19019,Sabon Gari
8.31377556,9.20898703,Universal Basic Education Ankolo,KD2002,Arak,19020,Sanga
8.30399313,9.56167025,Universal Basic Education Takau 2,KD0712,Takau,19007,Jema'A
8.410533,9.150324,Ungwan Makama Pilot Science Primary School,KD2010,Ninzo West,19020,Sanga
7.10638952,10.04081227,LGEA Katarma I,KD0201,Chikun,19002,Chikun
7.794826627,11.31816566,LEA Masaka,KD1601,Doka,19016,Kudan
7.64791236,10.92041596,Eccde Lamban Zango Pre Primary School,KD0412,Zangon Aya,19004,Igabi
7.45560071,10.47758667,Harry Royal Academy,KD0207,Narayi,19002,Chikun
7.422306667,10.46754167,Green Fields International School,KD1002,Barnawa,19010,Kaduna South
8.306130767,9.548921585,LGEA Unicef Model Primary School Tudun Wada Kaninkon,KD0710,Kaninkon,19007,Jema'A
8.517386667,9.792983334,Universal Basic Education Primary School,KD1411,Pari,19014,Kauru
8.27493388,9.779534341,Government Girls College Zonkwa,KD2210,Zonkwa,19022,Zangon Kataf
8.749580383,10.48512518,Universal Basic Education Jura Ll,KD1702,Dan Alhaji,19017,Lere
7.39783637,10.46813143,Winny International School,KD0208,Nassarawa,19002,Chikun
7.58032912,11.1963782,LGEA Primary School Hayin Gada B,KD0309,Shika,19003,Giwa
7.63740778,10.99954605,Universal Basic Education Tudun Gaude,KD2301,Dutsen Abba,19023,Zaria
6.757493019,10.9234786,Universal Basic Education Primary School Maganda Ii,KD0105,Magajin Gari 3,19001,Birnin Gwari
8.043687344,11.10909283,Universal Basic Education Daa Primary School,KD2110,Turawa,19021,Soba
8.055768013,11.23316109,Universal Basic Education Anguwan Bazai,KD1805,Gubuchi,19018,Makarfi
7.71787104,10.9271127,Universal Basic Education Damari Gari Primary School,KD0412,Zangon Aya,19004,Igabi
7.30351175,10.8121351,Eccde Sabon Birnin Daji Pre Primary School,KD0410,Sabon Birnin,19004,Igabi
7.932241559,9.658119679,Universal Basic Education Primary School Sabon Gari Gantan,KD0811,Kwaturu,19008,Kachia
7.42843821,10.43487112,World Class Schools,KD0212,Yelwa,19002,Chikun
7.71346511,10.88021559,Anguwan Bouwa Primary School,KD0411,Turunku,19004,Igabi
7.42985619,11.26141537,Nomadic Primary School Kwandari,KD0304,Giwa,19003,Giwa
7.3979691,10.45910504,Maranathan Children School,KD0210,Sabon Gari Nassarawa,19002,Chikun
7.750977874,11.3195765,Government Secondary School Kudan Junior,KD1606,Kudan,19016,Kudan
7.73427383,11.11941134,St?? John Nursery and Primary School,KD1908,Muchiya,19019,Sabon Gari
7.73931605,10.99248511,Damako Primary School,KD2313,Wuciciri,19023,Zaria
7.686599493,11.0502398,Government Secondary School Kofan Kuyanbana,KD2303,Gyellesu,19023,Zaria
7.47222423,10.58886082,LEA,KD0408,Rigachikun,19004,Igabi
7.916786671,11.3105911,Universal Basic Education,KD1804,Gimi,19018,Makarfi
8.32436021,9.692885501,Universal Basic Education Techet,KD2205,Madakiya,19022,Zangon Kataf
7.97955601,10.67711469,LEA Amanawa,KD1410,Makami,19014,Kauru
8.547855,10.30016667,LEA Primary School Rimi Dogon Daji,KD1709,Raminkura,19017,Lere
7.44294462,10.46216781,Maigana Road,KD0207,Narayi,19002,Chikun
7.40603905,10.59115857,Manomi,KD0401,Afaka,19004,Igabi
7.46619549,10.54391009,Ohikere Road,KD0910,Unguwar Rimi,19009,Kaduna North
7.441290018,10.49978468,Mopol Quarters,KD0904,Kabala,19009,Kaduna North
7.46549144,10.5916972,Jae Road 2,KD0408,Rigachikun,19004,Igabi
7.68230316,9.72453378,Rugan Monange,KD0803,Awon,19008,Kachia
8.13801365,11.43247798,Rugar Ahmadu,KD0505,Kuya,19005,Ikara
8.13823296,10.97488891,Rigar Ori,KD2101,Danwata,19021,Soba
7.60559528,11.14730881,Rigan Wakili Saadu,KD0308,Panhauya,19003,Giwa
7.43678479,10.53528493,Water Board,KD0911,Unguwar Sarki,19009,Kaduna North
7.03919797,10.26381423,Lassapa,KD0201,Chikun,19002,Chikun
8.762997249,10.57988139,Rugan Rabo,KD1702,Dan Alhaji,19017,Lere
7.98219354,9.73971493,Ruggar Alhaji Yunusa,KD0806,Gidan Tagwai,19008,Kachia
8.53428952,10.84158421,Rugar Wada Ibrahim,KD1502,Damau,19015,Kubau
7.96309647,11.39314037,Hayin Dan Kauye,KD1803,Gazara,19018,Makarfi
7.88113,11.37108167,Kofar Kudu,KD1807,Makarfi,19018,Makarfi
7.446649075,10.82799149,Kauyen Fati,KD0410,Sabon Birnin,19004,Igabi
8.42335666,9.84792029,Tsakiya Kibori,KD2208,Zaman Dabo,19022,Zangon Kataf
7.496366501,10.39868832,Sabuwa,KD0209,Rido,19002,Chikun
7.84674257,11.21623899,Mariga,KD1801,Dan Damisa,19018,Makarfi
8.11953984,9.52561463,Kurmin Kwara Rugar Alhaji Manu,KD0602,Daddu,19006,Jaba
8.060546601,10.97936747,Layin Malam Bako,KD2111,Soba,19021,Soba
7.739686916,9.5536707,Kasangwai,KD1105,Kagarko North,19011,Kagarko
7.39691609,10.59301405,Bayyan Sterling,KD0401,Afaka,19004,Igabi
7.39714929,10.44914949,Kubi Street,KD0210,Sabon Gari Nassarawa,19002,Chikun
7.70292814,11.04977995,Area Of Ginery House B,KD2304,Kaura,19023,Zaria
7.62203769,11.02771639,Gidan Lauje,KD2301,Dutsen Abba,19023,Zaria
7.28538693,11.07815709,Maje,KD0302,Galadimawa,19003,Giwa
8.10521181,10.95824989,Rugar Musa Jae,KD2111,Soba,19021,Soba
8.27603297,10.16411598,Unguwan Ibrahim,KD1402,Bital,19014,Kauru
7.56083083,10.54758747,Kan Rafi A,KD0204,Kujama,19002,Chikun
7.54212528,9.87743413,Alikuku,KD0805,Dokwa,19008,Kachia
7.46567333,10.5229746,Bathurst Street,KD0910,Unguwar Rimi,19009,Kaduna North
8.214314,9.15844025,Gidan Danfaro,KD2011,Wasa,19020,Sanga
8.03698486,9.53722212,Yakubu Sunday,KD0601,Chori,19006,Jaba
7.602052306,11.05275053,Gidan Sarkin Yaki,KD2301,Dutsen Abba,19023,Zaria
6.80773188,10.70307549,Ungwan Lukman,KD0206,Kuriga,19002,Chikun
7.54750923,10.38422082,Ruggan Alhaji Baba,KD0204,Kujama,19002,Chikun
8.32229011,9.71228556,Aduwan Gida,KD2205,Madakiya,19022,Zangon Kataf
7.7022244,11.09521828,Old Quarters,KD2309,Tukur Tukur,19023,Zaria
6.62443614,10.70910537,Kwaga 1,KD0101,Gayam,19001,Birnin Gwari
8.12816189,9.63783172,Unguwan Jaba,KD2207,Unguwan Rimi,19022,Zangon Kataf
8.39704436,9.72716207,Unguwar Bidoli,KD2206,Unguwar Gaya,19022,Zangon Kataf
7.45350565,10.54655548,Sultan Close,KD0911,Unguwar Sarki,19009,Kaduna North
7.39616642,11.31384051,Fulani Ori,KD0303,Gangara,19003,Giwa
7.645191288,10.47705777,Unguwar Dan Baki,KD0204,Kujama,19002,Chikun
8.46727379,9.85246094,Unguwan Baba,KD2208,Zaman Dabo,19022,Zangon Kataf
8.20751357,10.36282463,Rafin Rimi Unguwar Kudu,KD1409,Kwassam,19014,Kauru
7.596074765,11.28135222,Gidan Tulu,KD0301,Danmahawayi,19003,Giwa
7.640515755,10.95879515,Katsinawa Dumbi,KD0412,Zangon Aya,19004,Igabi
7.604490967,11.1160272,Gidan Galadima,KD0308,Panhauya,19003,Giwa
7.609110579,11.12221955,Dorayi,KD0308,Panhauya,19003,Giwa
8.54577844,10.34268024,Rugar Malam Muhammadu,KD1708,Lere,19017,Lere
7.70267559,11.10020062,Anguwan Fulani,KD2309,Tukur Tukur,19023,Zaria
7.65325961,11.16122159,Layin Tinau,KD1909,Samaru,19019,Sabon Gari
8.18776083,9.42601001,Unguwan Tambaya,KD0701,Asso,19007,Jema'A
7.6795896,11.05364641,Gwargwaje,KD2305,Kufena,19023,Zaria
7.38254313,11.34110224,Ungwar Tafida B,KD0303,Gangara,19003,Giwa
6.28819463,10.6776091,Chikwarba Anguwan Sule Magani,KD0102,Kakangi,19001,Birnin Gwari
8.09574134,11.5068067,Gidan Wake,KD0506,Paki,19005,Ikara
8.09403347,10.20843564,Tilde Bayero,KD2203,Ikulu,19022,Zangon Kataf
7.38542685,10.31749886,Layin Liman,KD0203,Kakau,19002,Chikun
8.38359023,10.23583052,Gaparun,KD1405,Geshere,19014,Kauru
7.03829934,10.24592946,Dakunu,KD0201,Chikun,19002,Chikun
7.78009709,10.76249859,Gidan Rimi,KD0405,Igabi,19004,Igabi
7.44532571,10.4566756,Galadima Street B,KD0207,Narayi,19002,Chikun
7.6759787,11.06317019,Anguwan Malam Shuaibu 2,KD2305,Kufena,19023,Zaria
7.43620337,10.43135378,Gbagyi Villa Joel Bala,KD0212,Yelwa,19002,Chikun
8.38355896,9.67069794,Unguwa Daniel Sabi,KD1308,Malagum,19013,Kaura
7.38586529,10.54109607,Usman Mai Kaji,KD0409,Rigasa,19004,Igabi
7.399682817,10.50641004,Dalhatu Maccido Close,KD1006,Sabon Gari North,19010,Kaduna South
7.90565355,9.47922353,Rugar Galemu Kushamfa A,KD1107,Katugal,19011,Kagarko
8.045917735,11.20990578,Rugar Chediya,KD1805,Gubuchi,19018,Makarfi
7.49671265,10.67936247,Unguwan Mai Shanu,KD0407,Kwarau,19004,Igabi
7.23389868,10.50932448,Bare Bari,KD0208,Nassarawa,19002,Chikun
7.40163676,10.52890075,Zuma Road,KD1013,Unguwan Sanusi,19010,Kaduna South
7.380481487,10.5396108,Gidan Balarabe Idris Jigo,KD0409,Rigasa,19004,Igabi
7.78131462,11.03750832,Gidan Mahauta Bogari,KD2313,Wuciciri,19023,Zaria
7.41624239,10.50741152,Hausawa By Kwanar Lami,KD1010,Tudun Wada South,19010,Kaduna South
7.74772587,10.70799003,Layin Tsamiya,KD0403,Fanshanu,19004,Igabi
7.44960296,9.69689267,Unguwan Wandala,KD0809,Katari,19008,Kachia
8.02387731,9.48720156,Unguwar Yakubu John,KD0607,Nok,19006,Jaba
8.269515095,10.21702079,Kipego,KD1402,Bital,19014,Kauru
7.83163237,10.98702072,Gagari,KD2105,Kinkiba,19021,Soba
7.9532515,11.06842301,Anguwar Kanawa B,KD2104,Gimba,19021,Soba
7.364669523,10.54479421,Ladi Wudil,KD0409,Rigasa,19004,Igabi
7.73150427,11.12474678,Layin Mangwarori,KD1908,Muchiya,19019,Sabon Gari
8.598407022,10.15531274,Unguwan Kero Bakin Kogi,KD1703,Garu Mariri,19017,Lere
8.03383454,9.31170049,Unguwan Wella,KD0703,Barde,19007,Jema'A
7.3943361,10.53548889,Sokoto Road,KD0409,Rigasa,19004,Igabi
7.59814615,10.99839809,Kudon Dikko Unguwar Liman,KD0406,Kerawa,19004,Igabi
7.62620948,10.37951121,Janwuria 1,KD1202,Buda,19012,Kajuru
8.086774785,10.62279108,Unguwan Munkaila,KD1410,Makami,19014,Kauru
6.987813333,11.11378,Rugar Jaae,KD0109,Kutemeshi,19001,Birnin Gwari
7.30466457,9.45097341,Chigomi Unguwar Sarki,KD1102,Iddah,19011,Kagarko
8.27169835,10.44282104,Fulanin Gumbari A,KD1409,Kwassam,19014,Kauru
8.78461647,10.30574599,Rugan Alhaji Mudi,KD1701,Abadawa,19017,Lere
8.52100071,9.66308845,Unguwar Ibrahim Nasamu,KD1309,Manchok,19013,Kaura
7.86365768,11.16265048,Anguwan Nuhu,KD2106,Kwasallo,19021,Soba
8.105797934,10.89953739,Rigar Haruna,KD2108,Rahama,19021,Soba
7.98762956,10.76433398,Kwankawa,KD2102,Gamagira,19021,Soba
7.40115998,10.45229195,Unguwan Wakili 2,KD1003,Kakuri Gwari,19010,Kaduna South
7.43418769,10.43000846,Gbagyi Villa Luka Barde,KD0212,Yelwa,19002,Chikun
7.7142014,11.06835493,Layin Malam Atiku Area,KD2306,Kwarbai A,19023,Zaria
7.43895427,10.5029292,Tanko Ayuba Road,KD0904,Kabala,19009,Kaduna North
8.33479547,10.02954508,Unguwar Jika,KD1402,Bital,19014,Kauru
7.47562513,10.63450455,Nasarawa,KD0408,Rigachikun,19004,Igabi
7.57499547,9.80701491,Kula Da Bako,KD0805,Dokwa,19008,Kachia
7.47718095,10.64821369,Bature Garban Garba,KD0408,Rigachikun,19004,Igabi
6.68598923,10.73875956,Rugar Saleh,KD0101,Gayam,19001,Birnin Gwari
8.53121173,9.87647271,Kurmin Risga Mangoro,KD1401,Badurum,19014,Kauru
8.25954963,10.98077639,Gidan Fulani Ibrahim,KD1508,Mah,19015,Kubau
7.71320152,10.34692576,Dogon Awo,KD1207,Kufana,19012,Kajuru
7.46181054,10.53280988,Birnin Gwari Close,KD0910,Unguwar Rimi,19009,Kaduna North
7.73129815,11.11889951,Layin Sharu Danlami,KD1908,Muchiya,19019,Sabon Gari
8.69337951,10.44005879,Bio Kara,KD1701,Abadawa,19017,Lere
7.90792702,10.23433734,Unguwan Sarki,KD1203,Idon,19012,Kajuru
7.757135062,10.66133342,Kabuwa Unguwan Shano,KD0403,Fanshanu,19004,Igabi
8.63093513,9.35763674,Unguwar Dagachin Mai Samari,KD2004,Bokana,19020,Sanga
7.45108569,10.46693894,Lawal Kaita Road,KD0207,Narayi,19002,Chikun
6.29293181,10.70693679,Kurgin Anguwan Sarki,KD0102,Kakangi,19001,Birnin Gwari
6.787466766,11.06746607,Junction Farin Ruwa,KD0105,Magajin Gari 3,19001,Birnin Gwari
8.1776103,10.23284266,Kadage,KD1402,Bital,19014,Kauru
8.268596848,10.33091619,Rugar Mohammadu,KD1409,Kwassam,19014,Kauru
